{
  "schemaVersion": 3,
  "lastUpdated": "2026-10-14T12:30:00+01:00",
  "sourceUrls": {
    "club": "https://www.lirf.dz/ar/club/733",
    "ranking": "https://www.lirf.dz/ar/ranking",
    "player": "https://www.lirf.dz/ar/player/{id}",
    "match": "https://www.lirf.dz/ar/match/{id}",
    "calendar": "https://www.lirf.dz/ar/calendar"
  },
  "sourceMeta": {
    "seasonId": "6",
    "seasonName": "2026/2027",
    "competitionId": "4275",
    "competitionAr": "شرق",
    "competitionLatin": "Ligue Inter-Régions Group East",
    "timezone": "Africa/Algiers",
    "palette": {
      "primary": "#e30613",
      "white": "#FFFFFF",
      "black": "#000000"
    },
    "relegationPlaces": 0
  },
  "club": {
    "id": "733",
    "name": {
      "ar": "شباب ميلة",
      "latin": "CBM Mila"
    },
    "short": "CBM",
    "city": "Mila",
    "country": "Algeria",
    "logo": "https://www.lirf.dz/clubs-logos/733-1656234689.png",
    "stadium": {
      "name": "Stade Belkacem Belaid, Mila",
      "ar": "ملعب بلقاسم بلعيد، ميلة",
      "source": "Stade Communal Belkacem Belaid"
    }
  },
  "staff": [
    {
      "id": "staff-1",
      "name": {
        "ar": "بلعريبي سعيد",
        "latin": "سعيد بلعريبي",
        "en": "سعيد بلعريبي"
      },
      "role": {
        "ar": "مدرب أكابر",
        "en": "Head coach"
      },
      "nationality": "الجزائر",
      "photoUrl": "https://www.lirf.dz/person-image/155316-1669552530.jpg"
    },
    {
      "id": "staff-2",
      "name": {
        "ar": "قياس محمد",
        "latin": "قياس محمد",
        "en": "قياس محمد"
      },
      "role": {
        "ar": "1er Entr. Adjoint Séniors",
        "en": "Assistant coach"
      },
      "nationality": "الجزائر",
      "photoUrl": "https://www.lirf.dz/person-image/612169-1772740180.jpg"
    },
    {
      "id": "staff-3",
      "name": {
        "ar": "يحياوي الوليد",
        "latin": "يحياوي الوليد",
        "en": "يحياوي الوليد"
      },
      "role": {
        "ar": "مدرب حراس أكابر",
        "en": "Goalkeeper coach"
      },
      "nationality": "الجزائر",
      "photoUrl": "https://www.lirf.dz/person-image/59277-1664706356.jpg"
    },
    {
      "id": "staff-4",
      "name": {
        "ar": "مسعي أسامة",
        "latin": "مسعي أسامة",
        "en": "مسعي أسامة"
      },
      "role": {
        "ar": "محضر بدني أكابر",
        "en": "Fitness coach"
      },
      "nationality": "الجزائر",
      "photoUrl": "https://www.lirf.dz/person-image/498704-1738235237.jpg"
    }
  ],
  "players": [
    {
      "id": "43091",
      "shirt": 1,
      "name": {
        "ar": "حميدي محمد بهاء الدين",
        "latin": "حميدي محمد بهاء الدين",
        "en": "حميدي محمد بهاء الدين"
      },
      "position": "GK",
      "birthDate": "2001-07-05",
      "approxAge": null,
      "nationality": "الجزائر",
      "photoUrl": "https://www.lirf.dz/licence-photo/photo-pro-870947-1789843107.png",
      "sourceUrl": "https://www.lirf.dz/ar/player/43091",
      "lastFetchedAt": null
    },
    {
      "id": "62230",
      "shirt": 30,
      "name": {
        "ar": "شابونية حسام",
        "latin": "شابونية حسام",
        "en": "شابونية حسام"
      },
      "position": "GK",
      "birthDate": "1997-01-21",
      "approxAge": null,
      "nationality": "الجزائر",
      "photoUrl": "https://www.lirf.dz/licence-photo/photo-pro-870975-1789845765.png",
      "sourceUrl": "https://www.lirf.dz/ar/player/62230",
      "lastFetchedAt": null
    },
    {
      "id": "129241",
      "shirt": 16,
      "name": {
        "ar": "مقيرد عمر",
        "latin": "مقيرد عمر",
        "en": "مقيرد عمر"
      },
      "position": "GK",
      "birthDate": "2006-09-06",
      "approxAge": null,
      "nationality": "الجزائر",
      "photoUrl": "https://www.lirf.dz/licence-photo/photo-pro-871473-1789845435.png",
      "sourceUrl": "https://www.lirf.dz/ar/player/129241",
      "lastFetchedAt": null
    },
    {
      "id": "72760",
      "shirt": 2,
      "name": {
        "ar": "فقراوي بلقاسم",
        "latin": "فقراوي بلقاسم",
        "en": "فقراوي بلقاسم"
      },
      "position": "DEF",
      "birthDate": null,
      "approxAge": 22,
      "nationality": "الجزائر",
      "photoUrl": "https://www.lirf.dz/licence-photo/photo-pro-870950-1789843145.png",
      "sourceUrl": "https://www.lirf.dz/ar/player/72760",
      "lastFetchedAt": null
    },
    {
      "id": "42007",
      "shirt": 3,
      "name": {
        "ar": "زكور اسامة",
        "latin": "زكور اسامة",
        "en": "زكور اسامة"
      },
      "position": "DEF",
      "birthDate": null,
      "approxAge": 30,
      "nationality": "الجزائر",
      "photoUrl": "https://www.lirf.dz/licence-photo/photo-pro-873472-1789845963.png",
      "sourceUrl": "https://www.lirf.dz/ar/player/42007",
      "lastFetchedAt": null
    },
    {
      "id": "36975",
      "shirt": 4,
      "name": {
        "ar": "قلبوزة بلقاسم",
        "latin": "قلبوزة بلقاسم",
        "en": "قلبوزة بلقاسم"
      },
      "position": "DEF",
      "birthDate": "1996-05-14",
      "approxAge": null,
      "nationality": "الجزائر",
      "photoUrl": "https://www.lirf.dz/licence-photo/photo-pro-870953-1789845132.png",
      "sourceUrl": "https://www.lirf.dz/ar/player/36975",
      "lastFetchedAt": null
    },
    {
      "id": "46519",
      "shirt": 5,
      "name": {
        "ar": "بولدياب بلال",
        "latin": "بولدياب بلال",
        "en": "بولدياب بلال"
      },
      "position": "DEF",
      "birthDate": null,
      "approxAge": 37,
      "nationality": "الجزائر",
      "photoUrl": "https://www.lirf.dz/licence-photo/photo-pro-870955-1789845155.png",
      "sourceUrl": "https://www.lirf.dz/ar/player/46519",
      "lastFetchedAt": null
    },
    {
      "id": "58378",
      "shirt": 20,
      "name": {
        "ar": "بن يحي سراج الدين",
        "latin": "بن يحي سراج الدين",
        "en": "بن يحي سراج الدين"
      },
      "position": "DEF",
      "birthDate": "2005-08-15",
      "approxAge": null,
      "nationality": "الجزائر",
      "photoUrl": "https://www.lirf.dz/licence-photo/photo-pro-870969-1789845542.png",
      "sourceUrl": "https://www.lirf.dz/ar/player/58378",
      "lastFetchedAt": null
    },
    {
      "id": "44171",
      "shirt": 22,
      "name": {
        "ar": "بن لعريبي سليمان",
        "latin": "بن لعريبي سليمان",
        "en": "بن لعريبي سليمان"
      },
      "position": "DEF",
      "birthDate": "1993-10-30",
      "approxAge": null,
      "nationality": "الجزائر",
      "photoUrl": "https://www.lirf.dz/licence-photo/photo-pro-870971-1789845612.png",
      "sourceUrl": "https://www.lirf.dz/ar/player/44171",
      "lastFetchedAt": null
    },
    {
      "id": "47553",
      "shirt": 24,
      "name": {
        "ar": "بودابة برهان",
        "latin": "بودابة برهان",
        "en": "بودابة برهان"
      },
      "position": "DEF",
      "birthDate": null,
      "approxAge": 28,
      "nationality": "الجزائر",
      "photoUrl": "https://www.lirf.dz/licence-photo/photo-pro-870972-1789845640.png",
      "sourceUrl": "https://www.lirf.dz/ar/player/47553",
      "lastFetchedAt": null
    },
    {
      "id": "42302",
      "shirt": 6,
      "name": {
        "ar": "عابد واسيم",
        "latin": "عابد واسيم",
        "en": "عابد واسيم"
      },
      "position": "MID",
      "birthDate": "2001-06-03",
      "approxAge": null,
      "nationality": "الجزائر",
      "photoUrl": "https://www.lirf.dz/licence-photo/photo-pro-873470-1789846014.png",
      "sourceUrl": "https://www.lirf.dz/ar/player/42302",
      "lastFetchedAt": null
    },
    {
      "id": "40940",
      "shirt": 8,
      "name": {
        "ar": "سياب يوسف إسلام",
        "latin": "سياب يوسف إسلام",
        "en": "سياب يوسف إسلام"
      },
      "position": "MID",
      "birthDate": null,
      "approxAge": 32,
      "nationality": "الجزائر",
      "photoUrl": "https://www.lirf.dz/licence-photo/photo-pro-870961-1789845276.png",
      "sourceUrl": "https://www.lirf.dz/ar/player/40940",
      "lastFetchedAt": null
    },
    {
      "id": "377274",
      "shirt": 10,
      "name": {
        "ar": "عقبي بن حدوش حسن",
        "latin": "عقبي بن حدوش حسن",
        "en": "عقبي بن حدوش حسن"
      },
      "position": "MID",
      "birthDate": "1989-08-17",
      "approxAge": null,
      "nationality": "الجزائر",
      "photoUrl": null,
      "sourceUrl": "https://www.lirf.dz/ar/player/377274",
      "lastFetchedAt": null
    },
    {
      "id": "52968",
      "shirt": 14,
      "name": {
        "ar": "عتامنة محمد عصام",
        "latin": "عتامنة محمد عصام",
        "en": "عتامنة محمد عصام"
      },
      "position": "MID",
      "birthDate": "1995-06-08",
      "approxAge": null,
      "nationality": "الجزائر",
      "photoUrl": "https://www.lirf.dz/licence-photo/photo-pro-870963-1789845335.png",
      "sourceUrl": "https://www.lirf.dz/ar/player/52968",
      "lastFetchedAt": null
    },
    {
      "id": "69852",
      "shirt": 15,
      "name": {
        "ar": "قيرة إسماعيل",
        "latin": "قيرة إسماعيل",
        "en": "قيرة إسماعيل"
      },
      "position": "MID",
      "birthDate": "1994-07-12",
      "approxAge": null,
      "nationality": "الجزائر",
      "photoUrl": "https://www.lirf.dz/licence-photo/photo-pro-870965-1789845401.png",
      "sourceUrl": "https://www.lirf.dz/ar/player/69852",
      "lastFetchedAt": null
    },
    {
      "id": "14596",
      "shirt": 19,
      "name": {
        "ar": "قدور عبد المالك",
        "latin": "قدور عبد المالك",
        "en": "قدور عبد المالك"
      },
      "position": "MID",
      "birthDate": null,
      "approxAge": 21,
      "nationality": "الجزائر",
      "photoUrl": "https://www.lirf.dz/licence-photo/photo-pro-870968-1789845520.png",
      "sourceUrl": "https://www.lirf.dz/ar/player/14596",
      "lastFetchedAt": null
    },
    {
      "id": "48886",
      "shirt": 25,
      "name": {
        "ar": "مبرك محمد تاج الدين",
        "latin": "مبرك محمد تاج الدين",
        "en": "مبرك محمد تاج الدين"
      },
      "position": "MID",